Job Title,Company Name,Experience Level,Work Type,Job Type,Location,Company type,Number of employees,Job description
Business Analyst,EG Allied Pvt. Ltd. ,,Remote,Full-time,India,,51-200,"
                We are looking for a business analyst 
professional who identifies goals, develops best practices for data 
collection, and analyses current processes so that they may be improved 
to the greatest extent possible.
RESPONSIBILITIES:      Evaluating
 business processes, anticipating requirements, uncovering areas for 
improvement, and developing and implementing solutions.Leading ongoing reviews of business processes and developing optimization strategies.Staying up to date on the latest process and IT advancements to automate and modernize systems.Conducting meetings and presentations to share ideas and findings.Performing requirements analysis.Managing competing resources and priorities.Monitoring deliverables and ensuring timely completion of projects.

REQUIREMENTS:      Advanced technical skills.Excellent documentation skills.Fundamental analytical and conceptual thinking skills.Experience creating detailed reports and giving presentations.Excellent planning, organizational, and time management skills.Experience leading and developing top-performing teams.

ABOUT US:Entire
 Globe Allied Pvt. Ltd provides services in the IT & BPO industry. 
Offering our services globally and connecting all to the world of 
innovation. We believe in providing the best solutions to our clients 
keeping Customer satisfaction and the brand’s reputation in mind. We are
 in the business of outsourcing services, providing complete business 
solutions for Start-ups, Small and Medium Businesses and currently 
expanding our reach towards large enterprises. We at EG Allied engage 
ourselves with innovative ideas to get a competitive advantage over 
global competition.
CONTACT US:E-Mail: info@egallied.comWebsite: www.egallied.comTo know more about us visit our website
            "
Enterprise Analyst,Decathlon Sports India ,Mid-Senior level,On-site,Full-time,Bengaluru,Retail,1001-5000,"We are looking for an Enterprise Analyst for the Decathlon global 
organization. The Enterprise Analytics team would use data, analytics, 
scenario and predictive modeling to drive enterprise performance, 
strategies and transformations, and steer actions needed by leaders to 
achieve company goals. In this role, you will build the reporting and 
analytics across multiple value dimensions to serve the strategic needs 
of the company, and deliver the insights needed to steer the business."
Business Analyst,FyerX - Your Trusted Marketing Partner ,Entry level,On-site,Full-time,Bengaluru,Marketing Services,11-50,"Salary Structure:

(5.4L Per Annum) 1- 6 Months - Rs. 30,000 per month (in hand) + Variable Pay upto Rs.15,000 per month

(6.6L Per Annum) 7-12 Months - Rs. 35,000 per month + Variable Pay upto Rs.20,000 per month

(7.8L Per Annum) 13-24 Months - Rs.40,000 per month + Variable Pay upto Rs.25,000 per month

Work Arrangement:

Work from Office

Location: BTM Layout, Bangalore

The
 Business Analyst will be responsible for managing a portfolio of 
clients, building and maintaining strong client relationships, 
identifying new business opportunities, and collaborating with 
cross-functional teams to ensure client needs are met. The Business 
Analyst will also be responsible for project management, budget 
management, and managing client expectations.

Responsibilities:

Client Relationship Management: Build
 and maintain robust relationships with clients, comprehending their 
business objectives and tailoring marketing solutions to their needs.

Project Coordination: Collaborate with internal teams and clients to establish project timelines, ensuring timely and successful delivery.

Progress Tracking: Meticulously update project management tools to track project progress and communicate updates to stakeholders.

Client Communication: Maintain
 clear and timely communication with clients via calls, WhatsApp, and 
email, professionally addressing queries and providing regular status 
updates.

Lead Engagement: Engage with potential clients from Facebook, Google Ads, and the FyerX website, nurturing leads and identifying opportunities.

Opportunity Identification: Proactively identify opportunities for upselling and cross-selling FyerX's diverse range of services to enhance client results.

Data Management: Manage the process of calling warm leads from Google and meticulously update lead data.

Documentation: Prepare compelling proposals, contracts, and other necessary documents to formalize client engagements.

Team Collaboration: Support internal teams to ensure on-time delivery of high-quality work.

Content Support: Assist in providing content guidance to internal resources and carefully review work deliverables before submission to clients.

Requirements:

Proven Experience: MBA Graduate preferred

Excellent Communication: Possess exceptional written and verbal communication skills.

Organizational Skills: Exceptional organizational and time-management abilities.

Technical Knowledge: Working
 knowledge of project management tools (ideally Zoho Projects) and 
customer relationship management software (ideally Zoho CRM).

Marketing Expertise: Understanding of key marketing services, including SEO, social media, website development, branding, and performance marketing.

Deadline-Driven: Ability to manage multiple projects simultaneously and thrive under tight deadlines.

If
 you have the required experience and skills, and are looking for a 
challenging role in a dynamic work environment, then we invite you to 
apply for the position of Business Analyst at FyerX."
Data Analyst,Apac Business Times,,Remote,Full-time,India,,51-200,"
                Company Description
 APAC
 Business Times is a B2B publication dedicated to empowering businesses 
across the Asia-Pacific (APAC) region. Our mission is to serve as a 
catalyst for growth and transformation, supporting businesses in their 
journey toward success in the global marketplace. We focus on improving 
brand identity, fostering innovation, and providing strategic insights 
to make informed decisions.
 Role Description
 This
 is a full-time remote role for a Data Analyst. The Data Analyst will be
 responsible for analyzing large datasets, utilizing data analytics and 
statistical methods to extract insights, and presenting findings to 
stakeholders. The role involves data modeling, identifying patterns and 
trends, and producing reports and visualizations to support informed 
decision-making.
 Qualifications
       Data Analytics, Statistical Analysis, and Data Modeling skillsStrong analytical skills and ability to work with large datasetsExcellent communication and presentation skillsProficiency in data analysis software and toolsExperience with data visualization and reportingStrong problem-solving and critical-thinking abilitiesAbility to work independently and remotelyExperience in the business or finance industry is a plusBachelor's degree in Data Science, Statistics, Mathematics, or related field

            "
ANALYST DATA & INSIGHTS,TE Connectivity,Associate,On-site,Full-time,Bengaluru,"Appliances, Electrical, and Electronics Manufacturing",10001+,"At TE, you will unleash your potential working with people
 from diverse backgrounds and industries to create a safer, sustainable 
and more connected world. 

Job Overview

TE
 Connectivity's Marketing Data & Insights teams provide deep data 
(internal and external sources) and analytics capabilities in support of
 all marketing activities including expertise in data methodologies, 
systems and tools, delivering insights to online and offline activities 
by harvesting and utilizing online and offline metrics and customer 
behavior patterns. They translate quantitative and qualitative data into
 actionable initiatives that drive engagement and deepen relationships 
and manage creation and distribution of dashboards to monitor company 
and department goals and key KPI’s and identify areas for growth and 
improvement, implement customer feedback mechanisms to capture voice of 
customer, and communicate findings and best practices to relevant 
stakeholders. They manage analysis, performance, placement and 
effectiveness of external marketing efforts including paid search, 
email, display, and new media. They have experience with Adobe suite of 
digital analytics tools, Eloqua, Salesforce.com, SEO, SEM, digital 
acquisition, and e-commerce, product marketing CRM processes, sales 
automation, lead generation and management.

Roles & Resposibilities

      Analyze
 marketing’s campaigns and demand generation program effectiveness at 
driving leads, customers, and revenue for the business unitBuild scable solutuons which can be adopted by adopted globallyIdentifies
 and generates needed insights to improve the business & marketing 
performance, shows leadership to bring insights forward, in addition to 
generating analyses when askedLeverage insights to propose segmentation, targeting & marketing effectiveness / improvementsUtilize various tools (Tableau, Alteryx) to join disparate data sources together to create a more robust story for the businessCollaborate
 cross functionally to prioritize new initiative/enhancements to be 
implemented to deliver against Marketing’s overall SMA & CRM 
objectivesCreate new and leverage existing traits/segments within DMP to destination map to marketing platformsCreate and distribute weekly, monthly, and quarterly performance reportsConduct ad hoc data analyses and performance reports as needed.


Qualifications And Experience

      BA/BS in Business, Finance, Economics, or other related field (Master a Plus)4-6 years of experience analyzing sales and marketing dataStrong
 ability to identify business issues, formulate plans to resolve these 
issues and effectively communicate the results to all levels of the 
organizationExperience with Tableau, Alteryx.Experience is analyzing digital data along with building complex ETL solution is desiredExperience in AWS, Python, regression, Machine learning etc. is a plusExperience
 with marketing analytics platforms and has worked on digital marketing 
data is an added benefit: Google Analytics, Google Adwords, Adobe 
Analytics, Adobe Target.Candidate certified in tools is an added advantageExperience with Root Cause Analysis (RCA), Gap Analysis, Cost Benefit Analysis and Risk Assessment Strong analytical skills with impeccable attention to detail and Microsoft Office ToolsAbility to collaborate in a global team environmentAbility to learn new tools quickly


Competencies

Values: Integrity, Accountability, Inclusion, Innovation, Teamwork

About Te Connectivity

TE
 Connectivity is a global industrial technology leader creating a safer,
 sustainable, productive, and connected future. Our broad range of 
connectivity and sensor solutions enable the distribution of power, 
signal and data to advance next-generation transportation, renewable 
energy, automated factories, data centers, medical technology and more. 
With more than 85,000 employees, including 8,000 engineers, working 
alongside customers in approximately 140 countries. TE ensures that 
EVERY CONNECTION COUNTS. Learn more at , ,

What Te Connectivity Offers

We
 are pleased to offer you an exciting total package that can also be 
flexibly adapted to changing life situations - the well-being of our 
employees is our top priority!

      Competitive Salary PackagePerformance-Based Bonus PlansHealth and Wellness IncentivesEmployee Stock Purchase ProgramCommunity Outreach Programs / Charity EventsEmployee Resource Group


Across our global sites and business units, we put together 
packages of benefits that are either supported by TE itself or provided 
by external service providers. In principle, the benefits offered can 
vary from site to site."
Data Analyst,Fraoula,,Remote,Full-time,India,,11-50,"
                Company Description
 Fraoula
 is a pioneering data and analytics company that leverages data to drive
 actionable insights and strategic decisions. We specialize in 
transforming raw data into valuable intelligence, empowering 
organizations to thrive in the digital age.
 Role Description
 This
 is a full-time remote role for a Data Analyst at Fraoula. The Data 
Analyst will be responsible for analyzing data, conducting data 
analytics, applying statistical techniques, and communicating insights 
to stakeholders. The Data Analyst will also be involved in data modeling
 and creating data visualizations.
 Qualifications
       Analytical Skills, Data Analytics, and StatisticsStrong communication skillsExperience with data modelingKnowledge of data visualization toolsStrong problem-solving skillsAttention to detail and accuracyAbility to work independently and remotelyExperience in the digital analytics industry is a plusBachelor's degree in Data Analytics, Statistics, Computer Science, or related field

            "
Data Analyst II,myGwork - LGBTQ+ Business Community,Entry level,Hybrid,Full-time,Bengaluru,"Technology, Information and Internet",11-50,"
                This inclusive employer is a member of myGwork – the largest global platform for the LGBTQ+ business community.  

Data Analyst-II

Do you like working with data and analytics to gain insight to solve problems?

Do you enjoy collaborating across teams to build and deliver products that make a difference?

About the Role:-

You
 will provide analytics thought partnership to our product teams. You 
will lead new feature and product improvement experimentation to 
quantify customer and business impact. You will brainstorm, define and 
calculate metrics to optimize the customer experience by generating 
insights to drive our products forward. You will collaborate with 
stakeholders and cross-functional technical teams as part of an embedded
 team.

About Our Team

Within
 Research Products, the role of the Product Analytics team is to turn 
the multitude of data into insights and AB testing opportunities that 
can be used to build better digital products. Like us, you thrive in a 
complex data environment. We like getting our hands into the data, 
focusing on insights which drive actions and product improvements. We 
extract data and make sense of it using SQL, Python/R, Tableau/Adobe 
Analytics and quantitative techniques (such as regression, or 
statistical testing).

How Product Analytics Drives Customer Outcomes.

Roles & Responsibilities: -

      Define
 the right metrics. Use your deep knowledge of user behavior to define 
performance metrics with your stakeholders that align with user success 
and satisfaction. For new features apply your customer centricity and 
business knowledge to identify and define the key metrics to evaluate 
product success. Collaborate with business stakeholders to define 
product OKRs to ensure we are focusing our efforts effectively.Measure
 performance. Set up dashboards and reports to track performance. Build 
models to understand product performance and user behavior - ultimately 
quantifying and communicating these insights through product metrics. 
Review user experience to ensure that the appropriate tagging and 
tracking is in place to improve our products. Create product/user 
funnels to understand and represent user behaviour and engagement with 
our products. Uncovering opportunities for new features, and 
collaborating with the Product Manager to define, prototype (& 
evaluate experiment results) and scale features & solutions. Identify
 and test opportunities for improvements. Grounded in deep analysis of 
our datasets, generate hypotheses and validate them through online 
experimentation and AB testing. Then deliver these together with product
 managers, designers and engineers. Support
 strategic decisions and roadmaps. Innovate and discover new insights by
 diving deeply into the data, combining various sources (including 
database and web-analytics data sources) from across the business, to 
support decisions and resolve strategic questions. Planning and 
prioritization with Product Managers. Helping them to understand which 
features could be built, quantify the user and business impact, and 
communicate these recommendations to senior leadership. Advocate
 Data-driven culture. Communicate insights and information effectively 
and engagingly, through presentations, reporting and dashboards to all 
levels of the organization. Advocate for a data-driven culture and help 
your stakeholders in how to interpret results. Empowering and enabling 
stakeholders across the business to make embrace the power of data and 
drive data informed decision making.


Skills & Requirements: -

      Growth Mindset. The right mix of passion, humility, positivity and desire to grow.Experience. Experience solving problems with data, collaborating with stakeholders as a data-driven thought partner. Preferred:
 Experience in product analytics, digital product optimization, A/B 
testing, and web-analytics. Demonstrable experience in data analysis and
 insight generation with business impact, incl. building predictive 
models. Ability to initiate and drive projects to completion with 
minimal guidance. Technical
 skills. Proficiency with SQL, Adobe Analytics and strong understanding 
of how to use data in solving problems. Preferred: Proficiency with 
Excel, Powerpoint, scripting (e.g., Python, R), the ability to analyze 
and combine large data sets in cloud data warehouse services such as 
Amazon Redshift, Snowflake (or other Postgres DB) and analytics 
platforms such as Databricks (Apache-Spark). Communication
 & Stakeholder management. Strong communicator and fluent in English
 (speaking and writing). Ability to communicate the findings and 
recommendations of analysis in a clear and effective manner at all 
levels, incl. experience with visual reporting and dashboarding tools 
(e.g., Tableau). Ability to engage with multiple stakeholders across the
 wider business. Preferred: Experience working cross culture and 
department, the ability to collaborate with stakeholders with different 
perspectives and priorities than yours. 


Education & Qualification. Bachelor/Master-level degree.

Preferred: Degree
 with quantitative focus (Statistics, Mathematics, Physics, Computer 
Science, or Economics with a strong analytical/statistical foundation)

Benefits: -

       Group Health Insurance Policy (covering self and family) Group Life insurance/accident policy Generous long-service awards New Baby gift


Work in a way that works for you

We
 promote a healthy work/life balance across the organisation. With an 
average length of service of 9 years, we are confident that we offer an 
appealing working prospect for our people. With numerous wellbeing 
initiatives, shared parental leave, study assistance and sabbaticals, we
 will help you meet your immediate responsibilities and your long-term 
goals.

      Working
 flexible hours - flexing the times when you work in the day to help you
 fit everything in and work when you are the most productive


Working with us

We
 are an equal opportunity employer with a commitment to help you 
succeed. Here, you will find an inclusive, agile, collaborative, 
innovative and fun environment, where everyone has a part to play. 
Regardless of the team you join, we promote a diverse environment with 
co-workers who are passionate about what they do, and how they do it.

Working for you

Benefits

As
 a spearhead of good employment practices, your health and wellbeing are
 of great importance to securing your future. These are some of the 
benefits we are delighted to offer:

      Dutch Share Purchase PlanAnnual Profit Share BonusComprehensive Pension PlanHome, office or commuting allowanceGenerous vacation entitlement and option for sabbatical leaveMaternity, Paternity, Adoption and Family Care leaveFlexible working hoursPersonal Choice budgetVariety of online training courses and career roadshowsWellbeing programs and gym facility in the officeInternal communities and networksVarious employee discounts


About Us:-

RELX is a global provider of information-based analytics and decision tools for professional and business customers.

We
 help scientists make new discoveries, doctors and nurses improve the 
lives of patients and lawyers win cases. We prevent online fraud and 
money laundering, and help insurance companies evaluate and predict 
risk. Our events enable customers to learn about markets, source 
products and complete transactions. In short, we enable our customers to
 make better decisions, get better results and be more productive. The 
Group serves customers in more than 180 countries and has offices in 
about 40 countries. It employs over 33,000 people, of which around 1/4th
 are technologists.

We want RELX to be a
 great place to work, where our employees feel valued, have equal 
opportunities and benefit from pay equality, regardless of their gender,
 gender identity, national origin, race, ethnicity, religion, sexual 
orientation, age or disability status. Inclusion and diversity are 
important to our future. We need the engagement of people from a wide 
range of backgrounds, experiences and ideas to achieve real innovation 
for our customers around the world.

About the business: -

A
 global leader in information and analytics, we help researchers and 
healthcare professionals' advance science and improve health outcomes 
for the benefit of society. Building on our publishing heritage, we 
combine quality information and vast data sets with analytics to support
 visionary science and research, health education and interactive 
learning, as well as exceptional healthcare and clinical practice. At 
Elsevier, your work contributes to the world's grand challenges and a 
more sustainable future. We harness innovative technologies to support 
science and healthcare to partner for a better world.

# LI-MC1

Elsevier
 is an equal opportunity employer: qualified applicants are considered 
for and treated during employment without regard to race, color, creed, 
religion, sex, national origin, citizenship status, disability status, 
protected veteran status, age, marital status, sexual orientation, 
gender identity, genetic information, or any other characteristic 
protected by law. We are committed to providing a fair and accessible 
hiring process. If you have a disability or other need that requires 
accommodation or adjustment, please let us know by completing our 
Applicant Request Support Form: https://forms.office.com/r/eVgFxjLmAK , 
or please contact 1-855-833-5120.

Please read our Candidate Privacy Policy.


            "
Data Scientist,Insight Global,Mid-Senior level,Remote,Contract,India,Staffing and Recruiting,1001-5000,"
                Exact compensation may vary based on several factors, including skills, experience, and education. Job Description *Insight
 Global is seeking a Senior Data Scientist to support a large Healthcare
 client. This candidate will support the clients Palantir development 
initiatives and will be part of a team that is using cutting edge 
technology to build solutions that works with large volumes of data 
across multiple platforms. They will partner with a team of data 
scientists, data gurus, and product owners to deliver products that will
 help drive decision making. Ultimately, this role will be responsible 
for translating business requirements and building machine learning 
models through all phases of development.
Responsibilities:Analyzing large amounts of information to find patterns and solutions.Creating data pipelines using Pipeline Builder and Code RepositoriesCreating and managing data modeling objectsAnalyzing data using tools like Code Workbook, Contour and QuiverEstablishing data connections, building data health monitors, and analyzing data lineageResponsible for building customer facing applications built within machine learning technologies.Being
 a visionary who can translate business needs, challenges and 
requirements into solutions that deliver value to the organization.
Required Skills and Experience *Bachelor's or master's degree in computer science, Information Technology, or other related field or equivalent work experience.2-5 years of data engineering experience2-5 years experience in predictive and prescriptive modeling.2-5 years experience in programming for large scale data analysis and data modernizationExperienced in Code Repositories / branching strategies.Hands-on experience with data science toolsAbility to write scripts for data manipulation, transformation, and analysis.Proficiency in languages such as Python, SQL, or R.Problem Solving AptitudeContinuously researches and evaluates emerging technologies.
Nice to Have Skills and ExperienceExperience in data engineering/ETL ecosystems with Palantir Foundry, Cognizant, AlteryxFamiliarity with machine learning algorithms and libraries (e.g., scikit-learn, TensorFlow, PyTorch).Certificates, Licenses, Registrations or Professional Designations
Certifications such as Foundry Application Developer Foundry Data Analyst, Foundry Data Engineer a plus
            "
